billionaire_id,publication,author,title,url,published_ts
25,Variety,Cynthia Littleton,Miley Cyrus and Pete Davidson’s Best ‘New Year’s Eve Party’ Moments — Updating Live,https://variety.com/2021/tv/news/miley-cyrus-pete-davidson-new-years-eve-party-moments-1235144766/,2022-01-01T03:46:00Z
25,Variety,Patrick Frater,"Fined $210 Million, Livestreaming Star Viya Is Latest Chinese Celebrity Handed Exemplary Punishment",https://variety.com/2021/global/asia/china-livestreaming-star-exemplary-punishment-1235142619/,2021-12-23T09:06:13Z
25,Motley Fool,newsfeedback@fool.com (Leo Sun),"If You'd Invested $5,000 in Alibaba in 2014, This Is How Much You Would Have Today",https://www.fool.com/investing/2021/12/17/if-invested-5000-alibaba-2014-how-much-today/,2021-12-17T13:25:00Z
25,Motley Fool,newsfeedback@fool.com (Leo Sun),"1 Green Flag for Alibaba in 2022, and 1 Red Flag",https://www.fool.com/investing/2022/01/10/1-green-flag-for-alibaba-in-2022-and-1-red-flag/,2022-01-10T16:26:53Z
25,Business Insider,insider@insider.com (Carla Mozée),Here are the top 10 stocks bought by retail traders in 2021,https://markets.businessinsider.com/news/stocks/top-retail-trader-stocks-2021-aapl-amc-nvda-tsla-2021-2021-12,2021-12-20T15:28:31Z
26,Reuters,,U.S. fishing industry teams up with oil lobby to fight offshore wind - Reuters,https://www.reuters.com/markets/commodities/us-fishing-industry-teams-up-with-oil-lobby-fight-offshore-wind-2021-12-17/,2021-12-17T16:26:00Z
26,Time,Tony Messenger,The Conservative Case For Prison Reform,https://time.com/6126200/conservative-prison-reform-movement/,2021-12-23T16:24:39Z
26,Yahoo Entertainment,Chauncey Alcorn,Report: Corporate donors gave to Manchin before his Build Back Better no-vote decision,https://news.yahoo.com/report-corporate-donors-gave-manchin-000500097.html,2021-12-23T00:05:00Z
26,Daily Beast,"Roger Sollenberger, William Bredderman",Secret Backer of 'Anti-Smoking' Vape Group? Big Tobacco...,https://www.thedailybeast.com/world-vapers-alliance-slams-cigarettes-big-british-american-tobacco-is-secretly-behind-it?source=articles&via=rss,2022-01-09T11:04:41Z
26,Nakedcapitalism.com,Lambert Strether,2:00PM Water Cooler 12/22/2021,https://www.nakedcapitalism.com/2021/12/200pm-water-cooler-12-22-2021.html,2021-12-22T19:00:36Z
26,Poynter,Barbara Allen,Thinking about a nonprofit student newsroom? These student journalists found legal and financial barriers at every turn,https://www.poynter.org/reporting-editing/2021/thinking-about-a-nonprofit-student-newsroom-these-student-journalists-found-legal-and-financial-barriers-at-every-turn/,2021-12-23T11:30:05Z
26,Poynter,Barbara Allen,These are the final stories from the Poynter College Media Project,https://www.poynter.org/educators-students/2021/these-are-the-final-stories-from-the-poynter-college-media-project/,2021-12-20T11:30:56Z
26,Poynter,Barbara Allen,How COVID-19 impacted student life at a one Texas commuter campus,https://www.poynter.org/educators-students/2021/how-covid-19-impacted-student-life-at-a-one-texas-commuter-campus/,2021-12-27T11:30:46Z
26,Poynter,Barbara Allen,The 10-year anniversary of the Jerry Sandusky indictments challenged Penn State journalists to dig deep and stand by their work,https://www.poynter.org/?p=979937,2021-12-30T11:32:06Z
26,Poynter,Barbara Allen,"With their Choose Your Own Adventure website, these student journalists asked their peers to consider the consequences of their housing choices",https://www.poynter.org/educators-students/2021/with-their-choose-your-own-adventure-website-these-student-journalists-asked-their-peers-to-consider-the-consequences-of-their-housing-choices/,2021-12-29T11:30:39Z
26,Poynter,Barbara Allen,These student journalists were determined to report on COVID-19 — with or without the University of Alabama’s support,https://www.poynter.org/educators-students/2021/these-student-journalists-were-determined-to-report-on-covid-19-with-or-without-the-university-of-alabamas-support/,2021-12-28T11:30:36Z
26,Poynter,Barbara Allen,A law would have allowed guns on campus at the University of Montana. These student journalists explored what could happen next,https://www.poynter.org/educators-students/2021/a-law-would-have-allowed-guns-on-campus-at-the-university-of-montana-these-student-journalists-explored-what-could-happen-next/,2021-12-22T11:30:13Z
26,Poynter,Barbara Allen,"Despite officials’ unwillingness to talk, students at The U got to the bottom of facial recognition technology on campus",https://www.poynter.org/educators-students/2021/despite-officials-unwillingness-to-talk-students-at-the-u-got-to-the-bottom-of-facial-recognition-technology-on-campus/,2021-12-21T11:30:50Z
26,Forbes,"Michela Tindera, Forbes Staff, 
 Michela Tindera, Forbes Staff
 https://www.forbes.com/sites/michelatindera/","Report: Boeing, Koch Industries Among Top Donors To Lawmakers Who Refused To Certify 2020 Election",https://www.forbes.com/sites/michelatindera/2022/01/03/report-boeing-koch-industries-among-top-donors-to-lawmakers-who-refused-to-certify-2020-election/,2022-01-03T18:43:05Z
26,Forbes,"Will Yakowicz, Forbes Staff, 
 Will Yakowicz, Forbes Staff
 https://www.forbes.com/sites/willyakowicz/",Where Is Cannabis Legal? A Guide To All 50 States,https://www.forbes.com/sites/willyakowicz/2022/01/10/where-is-cannabis-legal-a-guide-to-all-50-states/,2022-01-10T13:37:52Z
26,Democracy Now!,webdev@democracynow.org (Democracy Now!),Tea Party Redux: How the Koch Network Funds and Fuels the Anti-Lockdown Movement,https://www.democracynow.org/2021/12/23/koch_hijacked_war_on_covid,2021-12-23T13:25:43Z
26,Daily Beast,"Roger Sollenberger, William Bredderman",The Secret Backer of ‘Anti-Smoking’ Vape Group? Big Tobacco,https://www.thedailybeast.com/world-vapers-alliance-slams-cigarettes-big-british-american-tobacco-is-secretly-behind-it,2022-01-09T02:00:30Z
26,Crooksandliars.com,Common Dreams,Major Corporations Are Back To Funding Seditionist Republicans,https://crooksandliars.com/2022/01/major-corporations-are-back-funding,2022-01-05T15:22:42Z
26,The Washington Post,"Cristiano Lima, Aaron Schaffer",Big Tech critics mustered their forces in 2021 - The Washington Post,https://www.washingtonpost.com/politics/2021/12/16/big-tech-critics-mustered-their-forces-2021/,2021-12-16T14:17:18Z
26,CleanTechnica,Steve Hanley,"Our Completely Impartial, Unbiased Review Of “Don’t Look Up!”",https://cleantechnica.com/2021/12/30/our-completely-impartial-unbiased-review-of-dont-look-up/,2021-12-30T21:50:16Z
27,New Scientist,"Michael Le Page, Clare Wilson, Jessica Hamzelou, Sam Wong, Graham Lawton, Adam Vaughan, Conrad Quilty-Harper, Jason Arunn Murugesu, Layal Liverpool",Covid-19 news: WHO calls for holiday festivities to be postponed,https://www.newscientist.com/article/2237475-covid-19-news-who-calls-for-holiday-festivities-to-be-postponed/,2021-12-21T12:50:39Z
27,New Scientist,"Michael Le Page, Clare Wilson, Jessica Hamzelou, Sam Wong, Graham Lawton, Adam Vaughan, Conrad Quilty-Harper, Jason Arunn Murugesu, Layal Liverpool",Covid-19 news: Moderna booster stimulates antibodies against omicron,https://www.newscientist.com/article/2237475-covid-19-news-moderna-booster-stimulates-antibodies-against-omicron/,2021-12-20T13:15:39Z
27,New Scientist,"Michael Le Page, Clare Wilson, Jessica Hamzelou, Sam Wong, Graham Lawton, Adam Vaughan, Conrad Quilty-Harper, Jason Arunn Murugesu, Layal Liverpool",Covid-19 news: Booster omicron protection wanes within 10 weeks,https://www.newscientist.com/article/2237475-covid-19-news-booster-omicron-protection-wanes-within-10-weeks/,2021-12-24T12:57:39Z
27,Poynter,Barbara Allen,The 10-year anniversary of the Jerry Sandusky indictments challenged Penn State journalists to dig deep and stand by their work,https://www.poynter.org/?p=979937,2021-12-30T11:32:06Z
27,New Scientist,"Michael Le Page, Clare Wilson, Jessica Hamzelou, Sam Wong, Graham Lawton, Adam Vaughan, Conrad Quilty-Harper, Jason Arunn Murugesu, Layal Liverpool",Covid-19 news: Isolation rules for covid cases changed in England,https://www.newscientist.com/article/2237475-covid-19-news-isolation-rules-for-covid-cases-changed-in-england/,2021-12-22T11:36:39Z
27,Typepad.com,Glen B. Alleman,"Compendium of Resources for Digital Twins, Model-Based Systems Engineering and Integrated Program Performance Management",https://herdingcats.typepad.com/my_weblog/2022/01/compendium-of-resources-for-digital-twins-model-based-systems-enginering-and-integrated-program-perf.html,2022-01-10T00:23:46Z
27,New Scientist,"Michael Le Page, Clare Wilson, Jessica Hamzelou, Sam Wong, Graham Lawton, Adam Vaughan, Conrad Quilty-Harper, Jason Arunn Murugesu, Layal Liverpool",Covid-19 news: Chris Whitty urges caution as UK cases hit record level,https://www.newscientist.com/article/2237475-covid-19-news-chris-whitty-urges-caution-as-uk-cases-hit-record-level/,2021-12-16T11:00:39Z
27,New Scientist,"Michael Le Page, Clare Wilson, Jessica Hamzelou, Sam Wong, Graham Lawton, Adam Vaughan, Conrad Quilty-Harper, Jason Arunn Murugesu, Layal Liverpool",Covid-19 news: Omicron is dangerous despite lower hospitalisation risk,https://www.newscientist.com/article/2237475-covid-19-news-omicron-is-dangerous-despite-lower-hospitalisation-risk/,2021-12-23T12:50:39Z
27,New Scientist,"Michael Le Page, Clare Wilson, Jessica Hamzelou, Sam Wong, Graham Lawton, Adam Vaughan, Conrad Quilty-Harper, Jason Arunn Murugesu, Layal Liverpool",Covid-19 news: Pregnant women added to UK’s vaccine priority list,https://www.newscientist.com/article/2237475-covid-19-news-pregnant-women-added-to-uks-vaccine-priority-list/,2021-12-17T11:00:39Z
27,Wiley.com,"Loren Rieseberg, 
Emily Warschefsky, 
Bridget O’Boyle, 
Pierre Taberlet, 
Daniel Ortiz‐Barrientos, 
Nolan C. Kane, 
Benjamin Sibbett",Editorial 2022,https://onlinelibrary.wiley.com/doi/10.1111/mec.16328?af=R,2021-12-26T10:39:35Z
27,Daily Mail,"Jack Newman, David Wilcock, Bhvishya Patel, Harry Howard, Jamie Phillips",Covid: UK can lead world to normality says Nadhim Zahawi as Rishi Sunak backs five-day isolation,https://www.dailymail.co.uk/news/article-10385153/Britain-lead-world-normality-says-Nadhim-Zahawi-Rishi-Sunak-backs-five-day-isolation.html,2022-01-10T02:07:19Z
27,Cdc.gov,Office of Genomics and Precision Public Health,The Current Landscape of CDC Publications in Human Genomics and Public Health,https://blogs.cdc.gov/genomics/2022/01/10/the-current-landscape/,2022-01-10T13:20:29Z
27,Tim.blog,Tim Ferriss,"Q&A with Tim — Tools for Better Sleep, Musings on Parenting, The Different Roles of Fear, The Delight of Deepening Friendships, The Purpose of College, How to Boost Your Mood, HRV Training, and More (#557)",https://tim.blog/2021/12/22/qa-with-tim-sleep-parenting-fear/,2021-12-22T10:42:15Z
27,The Sports Daily,Jeff Fox,UFC Career Fighter Earnings,https://thesportsdaily.com/2022/01/01/ufc-fighter-salary-database-salary-main-ufc-career-fighter-earnings-html-fox11-2/,2022-01-01T04:00:38Z
28,Reuters,,Ground control to Maezawa: SoftBank's Son speaks to orbiting protege - Reuters,https://www.reuters.com/lifestyle/science/ground-control-maezawa-softbanks-son-speaks-orbiting-protege-2021-12-16/,2021-12-16T06:20:00Z
28,Reuters,,Softbank's Apollo landing does little to reassure - Reuters,https://www.reuters.com/markets/asia/softbanks-apollo-landing-does-little-reassure-2021-12-22/,2021-12-22T03:13:00Z
28,Reuters,,Credit Suisse may take legal action against SoftBank over Greensill debt -court document - Reuters,https://www.reuters.com/markets/europe/credit-suisse-may-take-legal-action-against-softbank-over-greensill-debt-court-2021-12-24/,2021-12-24T17:40:00Z
28,Business Insider,snagarajan@insider.com (Shalini Nagarajan),ProShares plans to launch a metaverse ETF that tracks companies like Apple and Meta,https://markets.businessinsider.com/news/etf/proshares-metaverse-etf-sec-approval-files-launch-apple-meta-nvidia-2021-12,2021-12-29T11:02:00Z
28,Bloomberg,"Suvashree Ghosh, Haslinda Amin","SoftBank Says India Digital Demand Strong, Will Keep Investing",https://www.bloomberg.com/news/articles/2021-12-17/softbank-says-india-digital-demand-strong-will-keep-investing,2021-12-17T05:43:36Z
28,Forbes,"William Pesek, Senior Contributor, 
 William Pesek, Senior Contributor
 https://www.forbes.com/sites/williampesek/",China Troubles Boomerang On SoftBank’s 2021 Vision,https://www.forbes.com/sites/williampesek/2021/12/16/china-troubles-boomerang-on-softbanks-2021-vision/,2021-12-16T10:20:05Z
28,Forbes,"Jemima McEvoy, Forbes Staff, 
 Jemima McEvoy, Forbes Staff
 https://www.forbes.com/sites/jemimamcevoy/",The Biggest Losers: These 10 Billionaires Each Lost At Least $10 Billion This Year,https://www.forbes.com/sites/jemimamcevoy/2021/12/21/the-biggest-losers-these-10-billionaires-each-lost-at-least-10-billion-this-year/,2021-12-21T11:30:00Z
28,Forbes,"Kenrick Cai, Forbes Staff, 
 Kenrick Cai, Forbes Staff
 https://www.forbes.com/sites/kenrickcai/",Data Startup Labelbox Reaches Toward $1 Billion Valuation With SoftBank Funding,https://www.forbes.com/sites/kenrickcai/2022/01/06/data-startup-labelbox-series-d-funding-from-softbank/,2022-01-06T12:00:00Z
28,Seeking Alpha,Value Detection,SoftBank Group Has A Lot To Offer,https://seekingalpha.com/article/4478564-softbank-group-has-a-lot-to-offer,2022-01-08T09:24:41Z
28,Seeking Alpha,Vincent Ventures,Palantir Learns From SoftBank; Taunts Wall Street,https://seekingalpha.com/article/4476587-palantir-learns-from-softbank-taunts-wall-street,2021-12-23T15:18:25Z
28,Forbes,"Jack McCullough, Senior Contributor, 
 Jack McCullough, Senior Contributor
 https://www.forbes.com/sites/jackmccullough/",The Power Of A CFO Netwok,https://www.forbes.com/sites/jackmccullough/2022/01/05/the-power-of-a-cfo-netwok/,2022-01-05T10:30:00Z
28,Strategy-business.com,by Mike Jakeman,Are venture capitalists misunderstood?,https://www.strategy-business.com/article/Are-venture-capitalists-misunderstood?gko=09f70,2021-12-16T06:00:00Z
28,The Japan Times,Gearoid Reidy,Venture capital cash flows to Japan following China crackdown,https://www.japantimes.co.jp/news/2021/12/16/business/economy-business/japan-startup-overseas-interest/,2021-12-16T02:02:02Z
28,The Japan Times,Gearoid Reidy,Venture capital cash flows to Japan following China crackdown,https://www.japantimes.co.jp/news/2021/12/16/business/financial-markets/japan-startup-overseas-interest/,2021-12-16T02:02:02Z
28,Yahoo Entertainment,Nivrita GANGULY,India's year of the unicorn: Startups in spotlight of 2021 tech boom,https://news.yahoo.com/indias-unicorn-startups-spotlight-2021-032741984.html,2021-12-31T03:27:41Z
28,Yahoo Entertainment,Paula Seligson and Gillian Tan,Apollo to Lend $4 Billion to SoftBank in Private Credit Deal,https://finance.yahoo.com/news/apollo-lend-4-billion-softbank-201123430.html,2021-12-22T03:22:59Z
28,Yahoo Entertainment,Paula Seligson and Gillian Tan,Apollo to Lend $4 Billion to SoftBank in Private Credit Deal,https://finance.yahoo.com/news/apollo-lend-4-billion-softbank-032259087.html,2021-12-22T03:22:59Z
28,Yahoo Entertainment,Gearoid Reidy,"China Crackdown, Hidden Unicorns Fuel Japan’s Big Startup Year",https://finance.yahoo.com/news/china-crackdown-hidden-unicorns-fuel-210000396.html,2021-12-16T08:22:19Z
28,CNA,,Ground control to Maezawa: SoftBank's Son speaks to orbiting protege,https://www.channelnewsasia.com/business/ground-control-maezawa-softbanks-son-speaks-orbiting-protege-2383771,2021-12-16T06:24:45Z
28,CNA,,Credit Suisse may take legal action against SoftBank over Greensill debt -court document,https://www.channelnewsasia.com/business/credit-suisse-may-take-legal-action-against-softbank-over-greensill-debt-court-document-2400721,2021-12-24T17:54:19Z
29,MarketWatch,Emily Bary,The Ratings Game: Dell rises to record high after analyst calls stock ‘compellingly inexpensive’,https://www.marketwatch.com/story/dell-rises-to-record-high-after-analyst-calls-stock-compellingly-inexpensive-11641851160,2022-01-10T21:46:00Z
29,Ritholtz.com,Barry Ritholtz,Transcript: Michael Mauboussin,https://ritholtz.com/2021/12/transcript-michael-mauboussin/,2021-12-19T17:00:32Z
29,Dpreview.com,Gannon Burgett,"LG's new 4K UltraFine OLED Pro monitor lineup features built-in calibration tool, now comes in 27"" option",https://www.dpreview.com/news/5795285510/lg-4k-ultrafine-oled-pro-monitor-lineup-features-built-in-calibration-tool-now-comes-in-27-option,2021-12-20T16:18:00Z
29,NPR,Anya Kamenetz,Here's what schools are doing to try to address students' social-emotional needs,https://www.npr.org/2021/12/23/1064975215/heres-what-schools-are-doing-to-try-to-address-students-social-emotional-needs,2021-12-23T12:01:20Z
29,NPR,Anya Kamenetz,Extra learning time is helping these students catch up from COVID interruptions,https://www.npr.org/2021/12/21/1063004934/extra-learning-time-is-helping-these-students-catch-up-from-covid-interruptions,2021-12-21T20:54:06Z
29,TechCrunch,Anna Heim,Newly minted unicorn Tackle plans to use $100 million Series C to accelerate the future of software sales,https://techcrunch.com/2021/12/21/newly-minted-unicorn-tackle-plans-to-use-100-million-series-c-to-accelerate-the-future-of-software-sales/,2021-12-21T13:04:34Z
29,Bloomberg,,"Bloomberg Businessweek Weekend - December 24th, 2021",https://www.bloomberg.com/news/audio/2021-12-23/bloomberg-businessweek-weekend-december-24th-2021,2021-12-23T22:06:24Z
29,Bloomberg,"Bibhudatta Pradhan, Vrishti Beniwal",Fed-Up Gig Workers Emerge as Fledgling Political Force in India,https://www.bloomberg.com/news/articles/2021-12-16/indian-gig-workers-take-government-company-demands-to-social-media,2021-12-16T01:00:11Z
29,Bloomberg,"Simon Kennedy, Chris Anstey","Central Banks Shift to Tolerating Covid, Tackling Inflation",https://www.bloomberg.com/news/newsletters/2021-12-17/what-s-happening-in-the-world-economy-tolerating-covid-tackling-inflation,2021-12-17T11:58:07Z
29,KQED,Anya Kamenetz,How extra funding and learning time are helping students catch up from COVID interruptions,https://www.kqed.org/mindshift/58872/how-extra-funding-and-learning-time-are-helping-students-catch-up-from-covid-interruptions,2021-12-22T08:51:37Z
29,PCWorld,Brad Chacos,Best of CES 2022: The most intriguing and innovative PC hardware,https://www.pcworld.com/article/563638/best-of-ces-2022-the-most-intriguing-and-innovative-pc-hardware.html,2022-01-11T20:03:12Z
29,Forbes,"Dileep Rao, Contributor, 
 Dileep Rao, Contributor
 https://www.forbes.com/sites/dileeprao/",4 Reasons Why Unicorn Foundations Should Be Built In High School,https://www.forbes.com/sites/dileeprao/2021/12/27/4-reasons-why-unicorn-foundations-should-be-built-in-high-school/,2021-12-27T15:50:03Z
29,Forbes,"Peter High, Contributor, 
 Peter High, Contributor
 https://www.forbes.com/sites/peterhigh/",Top Ten Tech Books Of 2021,https://www.forbes.com/sites/peterhigh/2022/01/05/top-ten-tech-books-of-2021/,2022-01-05T20:32:28Z
29,Forbes,"Patrick Moorhead, Senior Contributor, 
 Patrick Moorhead, Senior Contributor
 https://www.forbes.com/sites/patrickmoorhead/",Synaptics’ Potential On Full Display At CES 2022,https://www.forbes.com/sites/patrickmoorhead/2022/01/12/synaptics-potential-on-full-display-at-ces-2022/,2022-01-12T17:29:24Z
29,Bloomberg,Michelle Fay Cortez,Johnson & Johnson (JNJ) Vaccine Efficacy: Two Doses Slash Omicron Hospital Stays - Bloomberg,https://www.bloomberg.com/news/articles/2021-12-30/two-doses-of-j-j-s-vaccine-slashed-omicron-hospital-stays,2021-12-30T06:35:00Z
29,Forbes,"Steve Forbes, Forbes Staff, 
 Steve Forbes, Forbes Staff
 https://www.forbes.com/sites/steveforbes/",The Forbes 2021 All-Star Eateries In New York,https://www.forbes.com/sites/steveforbes/2021/12/19/the-forbes-2021-all-star-eateries-in-new-york/,2021-12-19T11:30:00Z
29,Taxfoundation.org,,2022 State Business Tax Climate Index - Tax Foundation,https://taxfoundation.org/2022-state-business-tax-climate-index/,2021-12-16T09:50:34Z
29,Seeking Alpha,SA Stocks To Watch,"Stocks To Watch: Big Banks Report Earnings, AMD-Xilinx Deal Drama, Huge Conferences In Retail And Healthcare",https://seekingalpha.com/article/4478518-stocks-to-watch-big-banks-report-earnings-amd-xilinx-deal-drama-huge-conferences-in-retail-and-healthcare,2022-01-08T12:00:00Z
29,Seeking Alpha,Trent Welsh,My $402k 29 Stock Portfolio Gets A Facelift And New Allocation Goals For 2022 As I Make New Big Bets,https://seekingalpha.com/article/4477696-my-portfolio-gets-a-facelift,2022-01-03T14:53:00Z
29,TechSpot,TechSpot Trivia,"All of these tech founders/CEOs stepped away for a stint before later returning to the helm, except...",https://www.techspot.com/trivia/80-all-tech-foundersceos-stepped-away-stint-before-later/,2021-12-22T19:27:00Z
30,Forbes,"Jemima McEvoy, Forbes Staff, 
 Jemima McEvoy, Forbes Staff
 https://www.forbes.com/sites/jemimamcevoy/",The Biggest Losers: These 10 Billionaires Each Lost At Least $10 Billion This Year,https://www.forbes.com/sites/jemimamcevoy/2021/12/21/the-biggest-losers-these-10-billionaires-each-lost-at-least-10-billion-this-year/,2021-12-21T11:30:00Z
30,Newsonjapan.com,,Uniqlo dangles $8.8m salaries to draw talent in Big Tech showdown,https://newsonjapan.com/html/newsdesk/article/133028.php,2022-01-16T00:51:44Z
30,Post Magazine,"Julian Ryall, Julian Ryall",Japan’s Uniqlo CEO Tadashi Yanai says won’t get sucked into US-China rivalry,https://www.scmp.com/week-asia/politics/article/3161574/japans-uniqlo-ceo-tadashi-yanai-says-wont-get-sucked-us-china,2021-12-30T10:00:59Z
30,Eastasiaforum.org,EAF editors,Japan needs to navigate a pathway between the United States and China,https://www.eastasiaforum.org/2022/01/03/japan-needs-to-navigate-a-pathway-between-the-united-states-and-china/,2022-01-03T01:00:50Z
30,China.org.cn,张军棉,"Uniqlo won't choose between US, China: CEO",http://www.china.org.cn/business/2022-01/10/content_77979302.htm,2022-01-10T05:00:00Z
30,China.org.cn,崔灿,Uniqlo founder refuses to play allegiance game,http://www.china.org.cn/world/2022-01/08/content_77977247.htm,2022-01-08T05:00:00Z
31,Independent,Travel Desk,The best cities to visit in 2022,https://www.independent.co.uk/travel/news-and-advice/best-cities-2022-travel-city-break-b1978260.html,2021-12-29T15:43:21Z
31,Artforum,,Guillaume Désanges to Lead Palais de Tokyo,https://www.artforum.com/news/guillaume-desanges-to-lead-palais-de-tokyo-87616,2022-01-11T20:46:00Z
31,Daily Mail,Millie Payne,"Salma Hayek, 55, puts her killer curves on full display in an eye-popping leopard-print swimsuit",https://www.dailymail.co.uk/tvshowbiz/article-10365019/Salma-Hayek-55-puts-killer-curves-display-eye-popping-leopard-print-swimsuit.html,2022-01-03T16:53:19Z
31,Luxurylaunches.com,SCMP,From restoring the Notre Dame to owning Europe’s richest sports team – Inside the luxurious life of Salma Hayek and François-Henri Pinault – The Kering CEO spares no effort to swoop his wife from her feet.,https://luxurylaunches.com/celebrities/inside-the-luxurious-life-of-salma-hayek-and-francois-henri-pinault.php,2022-01-02T10:54:21Z
31,New York Post,Cindy Adams,Former Rikers Island inmate recalls times he watched over Jeffrey Epstein,https://nypost.com/2022/01/04/rikers-island-inmate-recalls-times-he-watched-over-jeffrey-epstein/,2022-01-05T00:45:50Z
31,WWD,rosemaryfeitelberg,Kering and LVMH Respond to PETA’s Allegations in Asia,https://wwd.com/fashion-news/fashion-scoops/kering-and-lvmh-respond-to-petas-allegations-in-asia-1235020091/,2021-12-16T21:26:13Z
31,WWD,Lily Templeton,Year in Review: Alber Elbaz Dies — and the Industry Remembers Him,https://wwd.com/fashion-news/fashion-features/year-in-review-alber-elbaz-dies-and-the-industry-remembers-him-1235020645/,2021-12-22T11:01:43Z
31,WWD,joellediderich,"Media People: Paul-Emmanuel Reiffers, Founder and CEO of Mazarine",https://wwd.com/business-news/media/media-people-paul-emmanuel-reiffers-founder-and-ceo-of-mazarine-1235015582/,2021-12-20T05:01:42Z
31,Daily Mail,Dailymail.com,Fierce at 55! Salma Hayek puts her bombshell curves on show in stylish plunging swimsuit,https://www.dailymail.co.uk/tvshowbiz/article-10361459/Fierce-55-Salma-Hayek-puts-bombshell-curves-stylish-plunging-swimsuit.html,2022-01-01T22:50:20Z
31,New Zealand Herald,newsfeeds@nzherald.co.nz,"Salma Hayek, 55, shows off her stunning curves in plunging swimsuit",https://www.nzherald.co.nz/entertainment/salma-hayek-55-shows-off-her-stunning-curves-in-plunging-swimsuit/HGKPGAX6ZO2ZEAINKCQQKRYXFI/,2022-01-02T02:54:35Z
31,The Indian Express,Lifestyle Desk,Lunar New Year: Bottega Veneta takes over a part of the Great Wall of China,https://indianexpress.com/article/lifestyle/fashion/bottega-veneta-takes-over-a-part-of-the-great-wall-of-china-7719624/,2022-01-14T08:40:46Z
31,The Indian Express,New York Times,The year of Balenciaga,https://indianexpress.com/article/lifestyle/fashion/the-year-of-balenciaga-7684709/,2021-12-22T17:00:24Z
31,Euronews,,Art trends 2022: The growing influence of independent art spaces,https://www.euronews.com/culture/2021/12/23/art-trends-2022-the-growing-influence-of-independent-art-spaces,2021-12-23T11:56:36Z
32,Reuters,Jeremy Schultz,Pictures of the year: Natural disasters - Reuters India,https://www.reuters.com/news/picture/pictures-of-the-year-natural-disasters-idUSRTS3XJJT,2021-12-21T15:03:00Z
32,Reuters,,Reports: Texans fire head coach David Culley - Reuters,https://www.reuters.com/lifestyle/sports/reports-texans-fire-head-coach-david-culley-2022-01-13/,2022-01-13T20:33:00Z
32,Reuters,,Ex-UK Brexit minister Frost: My exit not about PM's leadership - Reuters,https://www.reuters.com/world/uk/ex-uk-brexit-minister-frost-my-exit-not-about-pms-leadership-2021-12-20/,2021-12-20T08:49:00Z
32,Reuters,,EU parliament head seriously ill in hospital - Reuters,https://www.reuters.com/world/europe/eu-parliament-head-seriously-ill-hospital-2022-01-10/,2022-01-10T16:21:00Z
