billionaire_id,publication,author,title,url,published_ts
59,Yahoo Entertainment,Venus Feng,China’s Tech Moguls See $80 Billion of Wealth Evaporate in 2021 - Yahoo Finance,https://finance.yahoo.com/news/china-tech-moguls-see-80-170000902.html,2021-12-29T17:00:00Z
59,Yahoo Entertainment,Venus Feng,China’s Tech Moguls See $80 Billion of Wealth Evaporate in 2021 - Yahoo Finance,https://finance.yahoo.com/news/china-tech-moguls-see-80-170000471.html,2021-12-29T17:00:00Z
59,Yahoo Entertainment,PR Newswire,Wavemaker Initiates Workplace Transformation with Intelligence Engine,https://finance.yahoo.com/news/wavemaker-initiates-workplace-transformation-intelligence-034800561.html,2022-01-05T03:48:00Z
59,Reason,Eugene Volokh,[Eugene Volokh] #TheyLied and the Fair Report Privilege,https://reason.com/volokh/2022/01/03/theylied-and-the-fair-report-privilege/,2022-01-03T13:01:58Z
59,Nature.com,"Jonathan B. Grimm, Luke D. Lavis",Caveat fluorophore: an insiders’ guide to small-molecule fluorescent labels,https://www.nature.com/articles/s41592-021-01338-6,2021-12-23T00:00:00Z
59,Plos.org,"Shan Wang, Ruhan Liu, Chu-Ren Huang",Social changes through the lens of language: A big data study of Chinese modal verbs,https://journals.plos.org/plosone/article?id=10.1371/journal.pone.0260210,2022-01-04T14:00:00Z
59,Plos.org,"Richard N. Day, Kathleen H. Day, Fredrick M. Pavalko","Direct visualization by FRET-FLIM of a putative mechanosome complex involving Src, Pyk2 and MBD2 in living MLO-Y4 cells",https://journals.plos.org/plosone/article?id=10.1371/journal.pone.0261660,2021-12-23T14:00:00Z
61,Reuters,,Billionaire Del Vecchio says Italian companies too focused on dividends -press - Reuters,https://www.reuters.com/business/billionaire-del-vecchio-says-italian-companies-too-focused-dividends-press-2021-12-28/,2021-12-28T06:37:00Z
61,Reuters,,Italy - Factors to watch on Dec. 20 - Reuters,https://www.reuters.com/markets/rates-bonds/italy-factors-watch-dec-20-2021-12-20/,2021-12-20T05:00:00Z
61,Yahoo Entertainment,Reuters,Generali's second-largest shareholder Caltagirone resigns from board,https://finance.yahoo.com/news/generalis-second-largest-shareholder-caltagirone-011334223.html,2022-01-14T01:13:34Z
61,Insurance Journal,Admin,Generali’s Boardroom Battle Escalates With Resignation of No. 2 Investor,https://www.insurancejournal.com/news/international/2022/01/14/649508.htm,2022-01-14T11:07:46Z
61,Yahoo Entertainment,Reuters,Generali shareholder pact remains intact after Caltagirone's resignation - source,https://ca.sports.yahoo.com/news/generali-shareholder-pact-remains-intact-083757767.html,2022-01-14T08:37:57Z
61,Catholicnewsagency.com,Hannah Brockhaus,Pope Francis: Visiting the sick is a Christian imperative,https://www.catholicnewsagency.com/news/250009/pope-francis-visiting-the-sick-is-a-christian-imperative,2022-01-04T12:05:00Z
61,Reuters,,Generali's second-largest shareholder Caltagirone resigns from board,https://www.reuters.com/world/europe/generalis-second-largest-shareholder-caltagirone-resigns-board-2022-01-14/,2022-01-14T01:14:01Z
62,Forbes,"Jemima McEvoy, Forbes Staff, 
 Jemima McEvoy, Forbes Staff
 https://www.forbes.com/sites/jemimamcevoy/",The Biggest Losers: These 10 Billionaires Each Lost At Least $10 Billion This Year,https://www.forbes.com/sites/jemimamcevoy/2021/12/21/the-biggest-losers-these-10-billionaires-each-lost-at-least-10-billion-this-year/,2021-12-21T11:30:00Z
62,The Times of India,Anuj Tiwari,From Azim Premji To Anil Agarwal: Meet Asia's 2021 Heroes Of Philanthropy,https://www.indiatimes.com/trending/social-relevance/forbes-asias-2021-heroes-of-philanthropy-558070.html,2021-12-30T11:35:17Z
63,Forbes,"Chadd Scott, Contributor, 
 Chadd Scott, Contributor
 https://www.forbes.com/sites/chaddscott/","From The White House To America’s First Modern Art Museum–Washington, D.C. As Arts Destination",https://www.forbes.com/sites/chaddscott/2021/12/26/from-the-white-house-to-americas-first-modern-art-museumwashington-dc-as-arts-destination/,2021-12-26T13:45:39Z
63,Artforum,Harry Cooper,Harry Cooper on Jasper Johns,https://www.artforum.com/print/202201/harry-cooper-on-jasper-johns-87450,2022-01-01T05:00:00Z
63,Page Six,Ian Mohr,Palm Beach NYE bash includes secluded COVID area for positive guests,https://pagesix.com/2022/01/01/palm-beach-nye-bash-has-covid-positive-area-next-door/,2022-01-01T19:09:41Z
64,Bloomberg,Adrian Kennedy,Our Best Reads of the Week,https://www.bloomberg.com/news/newsletters/2022-01-07/our-best-reads-of-the-week,2022-01-07T06:30:03Z
64,Bloomberg,Scott Carpenter,Billionaires Embracing Crypto in Case Money 'Goes to Hell'...,https://www.bloomberg.com/news/articles/2022-01-01/billionaires-dalio-peterffy-embrace-bitcoin-ethereum-as-inflation-hedge,2022-01-01T15:52:36Z
64,Motley Fool,newsfeedback@fool.com (Motley Fool Staff),Time for Another Edition of the Market Cap Game Show,https://www.fool.com/investing/2021/12/28/the-market-cap-game-show/,2021-12-29T00:45:52Z
64,Forbes,"Billy Bambrough, Senior Contributor, 
 Billy Bambrough, Senior Contributor
 https://www.forbes.com/sites/billybambrough/",Why A Billionaire Bitcoin And Ethereum Skeptic Suddenly Just Flipped And Made A Wild Crypto Price Prediction,https://www.forbes.com/sites/billybambrough/2022/01/04/why-a-billionaire-bitcoin-and-ethereum-skeptic-suddenly-just-flipped-and-made-a-wild-crypto-price-prediction/,2022-01-05T00:15:27Z
64,Forbes,"Billy Bambrough, Senior Contributor, 
 Billy Bambrough, Senior Contributor
 https://www.forbes.com/sites/billybambrough/","Legendary Billionaire Investor Reveals Huge Bitcoin Bet As The Price Of Ethereum, BNB, Solana, Cardano And XRP Suddenly Soar",https://www.forbes.com/sites/billybambrough/2022/01/11/legendary-billionaire-investor-reveals-huge-bitcoin-bet-as-the-price-ethereum-bnb-solana-cardano-and-xrp-suddenly-soar/,2022-01-12T00:45:22Z
64,Yahoo Entertainment,Yaёl Bizouati-Kennedy,Bitcoin’s Success Has Previously Skeptic Billionaires Changing Stances on Investing,https://finance.yahoo.com/news/bitcoin-success-previously-skeptic-billionaires-214731596.html,2022-01-03T21:47:31Z
64,Cointelegraph,Cointelegraph By Martin Young,More billionaires turning to crypto on fiat inflation fears,https://cointelegraph.com/news/more-billionaires-turning-to-crypto-on-fiat-inflation-fears,2022-01-03T03:42:22Z
64,Cointelegraph,Cointelegraph By Yashu Gola,"Ethereum plunges 13%, down more than Bitcoin after Fed spooks crypto market",https://cointelegraph.com/news/ethereum-plunges-13-down-more-than-bitcoin-after-fed-spooks-crypto-market,2022-01-06T12:41:11Z
64,Cointelegraph,Cointelegraph By Yashu Gola,"3 reasons why Ethereum can reach $5,000 in Q1",https://cointelegraph.com/news/3-reasons-why-ethereum-can-reach-5-000-in-q1,2022-01-04T16:24:00Z
64,Cointelegraph,Cointelegraph By Rakesh Upadhyay,"Price analysis 1/3: BTC, ETH, BNB, SOL, ADA, XRP, LUNA, AVAX, DOT, DOGE",https://cointelegraph.com/news/price-analysis-1-3-btc-eth-bnb-sol-ada-xrp-luna-avax-dot-doge,2022-01-03T18:19:35Z
64,Business Insider,ndailey@insider.com (Natasha Dailey),The Interactive Brokers' billionaire chairman — who once sounded alarm on bitcoin – now advises putting up to 3% of wealth in the cryptocurrency,https://www.businessinsider.com/interactive-brokers-bitcoin-chairman-thomas-peterffy-holdings-wealth-2022-1,2022-01-03T18:17:49Z
64,Activistpost.com,Activist Post,“Just In Case Fiat Money Goes To Hell”: Billionaires Are Finally Flooding Into Cryptos,https://www.activistpost.com/2022/01/just-in-case-fiat-money-goes-to-hell-billionaires-are-finally-flooding-into-cryptos.html,2022-01-03T00:08:23Z
64,Motley Fool Australia,Bernd Struben,Should ASX investors allocate 3% to Bitcoin and Ethereum?,https://www.fool.com.au/2022/01/06/should-asx-investors-allocate-3-to-bitcoin-and-ethereum/,2022-01-06T02:47:59Z
64,Business Standard,Scott Carpenter | Bloomberg,Billionaires are embracing crypto in case money 'goes to hell',https://www.business-standard.com/article/international/billionaires-are-embracing-crypto-in-case-money-goes-to-hell-122010300065_1.html,2022-01-02T21:49:00Z
64,Ritholtz.com,Barry Ritholtz,10 Tuesday AM Reads,https://ritholtz.com/2022/01/10-tuesday-am-reads-363/,2022-01-04T11:50:54Z
64,Slashdot.org,EditorDavid,Some Billionaires Embrace Cryptocurrencies in Case Money 'Goes to Hell',https://news.slashdot.org/story/22/01/02/1945249/some-billionaires-embrace-cryptocurrencies-in-case-money-goes-to-hell,2022-01-02T19:47:00Z
65,RT,RT,Here's how oil could hit $380 per barrel in 2050,https://www.rt.com/business/543749-oil-price-soaring-projection/,2021-12-20T16:20:46Z
65,OilPrice.com,Tsvetana Paraskova,Lukoil: Here's How Oil Could Hit $380 Per Barrel In 2050,https://oilprice.com/Latest-Energy-News/World-News/Lukoil-Heres-How-Oil-Could-Hit-380-Per-Barrel-In-2050.html,2021-12-17T23:30:00Z
65,Reuters,,Russia's Lukoil expects OPEC+ oil output rollover in January | Reuters,https://www.reuters.com/markets/commodities/russias-lukoil-expects-opec-oil-output-rollover-january-2021-12-17/,2021-12-17T10:05:04Z
66,Reuters,,Former French PM Fillon joins board of Russia's Sibur - Reuters,https://www.reuters.com/markets/asia/former-french-pm-fillon-joins-board-russias-sibur-2021-12-24/,2021-12-24T08:13:00Z
66,Bloomberg,Yuliya Fedorinova,The $31 Billion Plan to Make You Book Your Vacation in Siberia,https://www.bloomberg.com/news/articles/2021-12-18/the-31-billion-plan-to-make-you-book-your-vacation-in-siberia,2021-12-18T03:00:11Z
66,Artforum,,Teresa Iarocci Mavica Out as Director General of Moscow’s V-A-C Foundation,https://www.artforum.com/news/teresa-iarocci-mavica-out-as-director-general-of-moscow-s-v-a-c-foundation-87591,2022-01-03T22:49:00Z
66,Sputnik International,Kirill Kurevlev,"Top 10 Richest People on Earth Got Wealthier by Over $400 Bln in 2021, Bloomberg Index Shows",https://sputniknews.com/20211230/top-10-richest-people-on-earth-got-wealthier-by-over-400-bln-in-2021-bloomberg-index-shows-1091924557.html,2021-12-30T23:32:56Z
66,ARTnews,Angelica Villa,Director of Moscow’s V-A-C Foundation to Step Down to Focus on Venice Outpost,https://www.artnews.com/art-news/news/teresa-iarocci-mavica-vac-foundation-director-1234614720/,2021-12-30T18:25:14Z
66,ARTnews,Alex Greenberger,A New Art Center Challenges the Rules in Moscow,https://www.artnews.com/art-news/news/ges-2-house-of-culture-opening-1234614228/,2021-12-23T15:00:28Z
66,POLITICO.eu,Thibault Spirlet,Former French PM Fillon joins board of Russian petrochemical giant,http://www.politico.eu/article/france-francois-fillon-sibur-board-job-russia-petrochemical/,2021-12-24T10:56:23Z
66,Carnegiemoscow.org,"Vita Spivak, Alexander Gabuev",The Ice Age: Russia and China's Energy Cooperation in the Arctic,https://carnegiemoscow.org/commentary/86100,2021-12-31T08:50:03Z
67,ABC News,BRIAN MELLEY Associated Press,Kin of dead sex abuse victim sue under new California law,https://abcnews.go.com/Politics/wireStory/kin-dead-sex-abuse-victim-sue-california-law-82212415,2022-01-12T03:55:19Z
67,Ritholtz.com,Barry Ritholtz,MiB: Max Chafkin on Thiel & Tech,https://ritholtz.com/2021/12/mib-max-chafkin/,2021-12-25T14:30:17Z
67,Ritholtz.com,Barry Ritholtz,Transcript: Max Chafkin,https://ritholtz.com/2021/12/transcript-max-chafkin/,2021-12-26T17:00:43Z
67,Motley Fool,newsfeedback@fool.com (Sean Williams),4 Fast-Growing Stocks Billionaires Can't Stop Buying,https://www.fool.com/investing/2021/12/17/4-fast-growing-stocks-billionaires-are-buying/,2021-12-17T10:51:00Z
67,ESPN,Jim McCormick,Fantasy basketball daily notes for Friday: Now's the time to trade for Shai Gilgeous-Alexander,https://www.espn.com/fantasy/basketball/story/_/id/33065379/fantasy-basketball-daily-notes-friday-now-time-trade-shai-gilgeous-alexander,2022-01-14T15:53:24Z
67,ESPN,Jim McCormick,Fantasy basketball daily notes for Monday: Last-place Pistons find reasons to smile,https://www.espn.com/fantasy/basketball/story/_/id/32984716/fantasy-basketball-daily-notes-monday-last-place-pistons-find-reasons-smile,2022-01-03T14:40:10Z
67,ESPN,Jim McCormick,Fantasy basketball daily notes for Monday: Klay Thompson returns,https://www.espn.com/fantasy/basketball/story/_/id/33033841/fantasy-basketball-daily-notes-monday-klay-thompson-returns,2022-01-10T14:46:33Z
67,ESPN,Jim McCormick,Fantasy basketball daily notes for Thursday: Malik Monk is far from silent,https://www.espn.com/fantasy/basketball/story/_/id/33056224/fantasy-basketball-daily-notes-thursday-malik-monk-far-silent,2022-01-13T13:04:43Z
67,Forbes,"GuruFocus, Contributor, 
 GuruFocus, Contributor
 https://www.forbes.com/sites/gurufocus/",3 Industrial Stocks To Ring In The New Year With,https://www.forbes.com/sites/gurufocus/2021/12/30/3-industrial-stocks-to-ring-in-the-new-year-with/,2021-12-30T20:39:09Z
67,Forbes,"GuruFocus, Contributor, 
 GuruFocus, Contributor
 https://www.forbes.com/sites/gurufocus/",Buffett's Top 5 Holdings See Mixed Performances In 2021,https://www.forbes.com/sites/gurufocus/2021/12/28/buffetts-top-5-holdings-see-mixed-performances-in-2021/,2021-12-28T21:28:43Z
67,Forbes,"GuruFocus, Contributor, 
 GuruFocus, Contributor
 https://www.forbes.com/sites/gurufocus/","Muhlenkamp’s Firm Buys Equity Commonwealth, Dumps 2 Stocks",https://www.forbes.com/sites/gurufocus/2021/12/17/muhlenkamps-firm-buys-equity-commonwealth-dumps-2-stocks/,2021-12-17T20:51:37Z
67,Forbes,"GuruFocus, Contributor, 
 GuruFocus, Contributor
 https://www.forbes.com/sites/gurufocus/",Tesla Triumphs Among Cathie Wood's Top Holdings,https://www.forbes.com/sites/gurufocus/2022/01/07/tesla-triumphs-among-cathie-woods-top-holdings/,2022-01-07T19:49:13Z
67,Seeking Alpha,Dividend Sensei,10 Blue-Chips For Retiring In Safety And Splendor,https://seekingalpha.com/article/4475536-10-blue-chips-retiring-safety-splendor,2021-12-16T13:11:49Z
67,Seeking Alpha,Doug Noland,Weekly Commentary: Kaufman Knows Inflation,https://seekingalpha.com/article/4479906-weekly-commentary-kaufman-knows-inflation,2022-01-16T16:42:00Z
67,Themillions.com,Editor,Most Anticipated: The Great First Half 2022 Book Preview,https://themillions.com/2022/01/most-anticipated-the-great-first-half-2022-book-preview.html,2022-01-13T11:00:37Z
67,Bleeding Cool News,Rich Johnston,Full Marvel Comics March 2022 Solicits And Solicitations,https://bleedingcool.com/comics/full-marvel-comics-march-2022-solicits-and-solicitations/,2021-12-22T14:59:12Z
67,Independent,Via AP news wire,Kin of dead sex abuse victim sue under new California law,https://www.independent.co.uk/news/lawyers-california-roman-catholic-church-los-angeles-benedict-xvi-b1991219.html,2022-01-12T02:08:40Z
67,Yahoo Entertainment,Hamna Asim,10 Energy Dividend Stocks to Buy According to Billionaire Jim Simons’ Portfolio,https://finance.yahoo.com/news/10-energy-dividend-stocks-buy-170621593.html,2022-01-13T17:06:21Z
67,Yahoo Entertainment,Debasis Saha,"Do Hedge Funds Love WisdomTree Investments, Inc. (WETF)?",https://finance.yahoo.com/news/hedge-funds-love-wisdomtree-investments-232449635.html,2021-12-17T23:24:49Z
67,Yahoo Entertainment,Tom Maloney,Ken Griffin’s Fortune Soars to $28 Billion on Citadel Securities Deal,https://finance.yahoo.com/news/ken-griffin-fortune-soars-28-211746383.html,2022-01-11T21:17:46Z
69,BBC News,https://www.facebook.com/bbcnews,Scott Marsh: Viral and controversial art of 'Australia's Banksy',https://www.bbc.co.uk/news/world-australia-59723656,2021-12-27T00:01:39Z
69,This is Money,Daily,Are you a City slicker or slacker? Check your knowledge of 2021 events,https://www.thisismoney.co.uk/money/markets/article-10340593/Are-City-slicker-slacker-Check-knowledge-2021-events.html,2021-12-23T22:03:56Z
69,Motley Fool Australia,Mitchell Lawler,The Vulcan Energy (ASX:VUL) share price is down 12% this week. What’s happening?,https://www.fool.com.au/2021/12/23/the-vulcan-energy-asx-vul-share-price-is-down-12-so-far-this-week-whats-happening/,2021-12-23T00:19:53Z
69,Independent Australia,,Appointment of Murdoch mate to top job raises eyebrows,"https://independentaustralia.net/politics/politics-display/appointment-of-murdoch-mate-to-top-job-raises-eyebrows,15939",2022-01-15T22:00:00Z
70,New York Times,The New York Times,Business updates: Plans to return to the office grow murkier by the day.,https://www.nytimes.com/live/2021/12/20/business/news-business-stock-market,2021-12-20T12:55:12Z
70,CNN,"Rishi Iyengar, CNN Business",The key moments from Elizabeth Holmes' trial,https://www.cnn.com/2022/01/03/tech/theranos-trial-elizabeth-holmes-takeaways/index.html,2022-01-04T02:05:03Z
70,BBC News,https://www.facebook.com/bbcnews,Scott Marsh: Viral and controversial art of 'Australia's Banksy',https://www.bbc.co.uk/news/world-australia-59723656,2021-12-27T00:01:39Z
70,Reuters,,DirecTV loss could cripple rightwing One America News - Reuters,https://www.reuters.com/business/media-telecom/directv-loss-could-cripple-rightwing-one-america-news-2022-01-15/,2022-01-15T16:51:00Z
70,The Guardian,Rupert Neate Wealth correspondent,Elizabeth Holmes: from ‘next Steve Jobs’ to convicted fraudster,https://amp.theguardian.com/technology/2022/jan/04/elizabeth-holmes-from-next-steve-jobs-to-convicted-fraudster,2022-01-04T14:27:47Z
70,The Guardian,Kari Paul in San Jose,Elizabeth Holmes trial: jury deliberations begin for Theranos founder,https://amp.theguardian.com/technology/2021/dec/17/elizabeth-holmes-trial-theranos-latest,2021-12-18T01:12:57Z
70,The Guardian,Editorial,The Guardian view on Elizabeth Holmes: fake it to make it until you break it | Editorial,https://amp.theguardian.com/commentisfree/2022/jan/05/the-guardian-view-on-elizabeth-holmes-fake-it-to-make-it-until-you-break-it,2022-01-05T19:13:34Z
70,The Guardian,Kari Paul,Holmes verdict an indictment of Silicon Valley’s ‘fake it till you make it’ ethos,https://amp.theguardian.com/technology/2022/jan/04/elizabeth-holmes-verdict-analysis,2022-01-04T06:00:07Z
70,The Guardian,Veronica Horwell,Grace Mirabella obituary,https://amp.theguardian.com/fashion/2022/jan/12/grace-mirabella-obituary,2022-01-12T13:40:08Z
70,The Guardian,Kari Paul in San Jose,"What I saw at the Theranos trial: long lines, superfans and the enduring power of Elizabeth Holmes",https://amp.theguardian.com/technology/2021/dec/18/theranos-trial-elizabeth-holmes,2021-12-18T11:00:00Z
70,The Guardian,Kari Paul,Elizabeth Holmes trial: Silicon Valley watches next steps in high-profile case,https://amp.theguardian.com/technology/2022/jan/04/elizabeth-holmes-conviction-silicon-valley,2022-01-04T19:30:17Z
70,CP24 Toronto's Breaking News,Michael Liedtke,Holmes jury says it's deadlocked on 3 of 11 criminal charges - CP24 Toronto's Breaking News,https://www.cp24.com/news/holmes-jury-says-it-s-deadlocked-on-3-of-11-criminal-charges-1.5726387,2022-01-03T20:06:00Z
70,Ctvnews.ca,Michael Liedtke,Elizabeth Holmes jury deadlocked on 3 charges - CTV News,https://www.ctvnews.ca/world/elizabeth-holmes-jury-affirms-deadlock-on-3-of-11-charges-1.5726082,2022-01-03T22:36:20Z
70,Global News,The Associated Press,"Maxwell guilty verdict doesn’t bode well for Prince Andrew, experts say - Global News",https://globalnews.ca/news/8481527/ghislaine-maxwell-guilty-prince-andrew/,2021-12-31T02:14:24Z
70,Ctvnews.ca,Danica Kirka,Prince Andrew's civil case: What does Maxwell verdict mean? - CTV News,https://www.ctvnews.ca/world/maxwell-verdict-bodes-ill-for-prince-andrew-s-civil-case-1.5723562,2021-12-30T19:34:26Z
70,CP24 Toronto's Breaking News,Michael Liedtke,Elizabeth Holmes jury split on three of 11 fraud charges - CP24 Toronto's Breaking News,https://www.cp24.com/news/former-theranos-ceo-holmes-guilty-of-fraud-and-conspiracy-1.5726387,2022-01-03T20:06:00Z
70,CP24 Toronto's Breaking News,Danica Kirka,Maxwell verdict bodes ill for Prince Andrew's civil case - CP24 Toronto's Breaking News,https://www.cp24.com/world/maxwell-verdict-bodes-ill-for-prince-andrew-s-civil-case-1.5723561,2021-12-30T19:30:43Z
70,Yahoo Entertainment,The Hill,"Elizabeth Holmes GUILTY of fraud. Devos family, Walmart heirs, and Rupert Murdoch DUPED by Theranos",https://news.yahoo.com/elizabeth-holmes-guilty-fraud-devos-152000897.html,2022-01-04T15:20:00Z
70,Time,MICHAEL LIEDTKE/AP,Elizabeth Holmes Jury Says It’s Deadlocked on 3 of 11 Criminal Charges,https://time.com/6132540/elizabeth-holmes-jury-deadlock/,2022-01-03T20:31:28Z
70,Time,MICHAEL LIEDTKE/AP,Jury Finds Theranos CEO Elizabeth Holmes Guilty of Fraud and Conspiracy,https://time.com/6132636/elizabeth-holmes-guilty/,2022-01-04T00:45:32Z
71,The Indian Express,Dipanita Nath,"Pune This Week: Experience magic of galaxy, take part in art symposium and watch theatre",https://indianexpress.com/article/cities/pune/pune-this-week-7711013/,2022-01-07T06:40:02Z
71,The Economist,The Economist,Why Brahmins lead Western firms but rarely Indian ones,https://www.economist.com/asia/2022/01/01/why-brahmins-lead-western-firms-but-rarely-indian-ones,2021-12-30T10:20:48Z
71,The Economist,The Economist,Why Brahmins lead Western firms but rarely Indian ones,https://www.economist.com/asia/2021/12/29/why-brahmins-lead-western-firms-but-rarely-indian-ones,2021-12-29T15:42:43Z
71,The Indian Express,"Rajat Kathuria, Isha Suri",There must be fair competition in telecom sector,https://indianexpress.com/article/opinion/columns/telecom-sector-vodafone-idea-liability-7720193/,2022-01-12T22:45:26Z
71,Hindustan Times,hindustantimes.com,"Billionaires Index: Gautam Adani slips by a spot, is 14th richest in world - Hindustan Times",https://www.hindustantimes.com/business/billionaires-index-gautam-adani-slips-by-a-spot-is-14th-richest-in-world-101639831414190.html,2021-12-18T13:22:47Z
71,The Indian Express,IE Online,"Recognise kids as individuals, not just students",https://indianexpress.com/article/opinion/columns/recognise-kids-as-individuals-not-just-students-7702706/,2022-01-02T22:45:15Z
71,Livemint,mint,Global initiatives may help revive the education of Afghan women,https://www.livemint.com/opinion/online-views/global-initiatives-may-help-revive-the-education-of-afghan-women-11641400207991.html,2022-01-05T16:35:32Z
71,The Times of India,Amit Mudgill,"Billionaires 2021: Adani's wealth soars $41 bn, Premji adds more billions than Mukesh Ambani",https://economictimes.indiatimes.com/markets/stocks/news/billionaires-2021-adanis-wealth-soars-41-bn-premji-adds-more-billions-than-mukesh-ambani/articleshow/88607264.cms,2021-12-31T05:57:48Z
71,The Times of India,Vanya Gautam,IT Giant HCL Reportedly Asked Resigning Employees To 'Return' Their Bonuses,https://www.indiatimes.com/worth/news/hcl-reportedly-asked-resigning-employees-to-return-bonus-559241.html,2022-01-13T09:15:09Z
71,The Times of India,Anuj Tiwari,From Azim Premji To Anil Agarwal: Meet Asia's 2021 Heroes Of Philanthropy,https://www.indiatimes.com/trending/social-relevance/forbes-asias-2021-heroes-of-philanthropy-558070.html,2021-12-30T11:35:17Z
74,Android Authority,Roger Fingas,Should you consider investing in Xiaomi smart home tech?,https://www.androidauthority.com/xiaomi-mi-home-smart-home-3087137/,2022-01-16T10:00:53Z
74,Al Jazeera English,Michele Koh Morollo,"China’s year of crackdowns: Party first, business second",https://www.aljazeera.com/economy/2021/12/27/chinas-year-of-crackdowns-party-first-business-second,2021-12-27T00:38:14Z
74,GSMArena.com,Yordan,Xiaomi introduces MIUI 13 with enhanced security and privacy,https://www.gsmarena.com/xiaomi_introduces_miui_13_with_privacy_enhanced_security-news-52455.php,2021-12-28T13:12:02Z
74,GSMArena.com,Yordan,"Xiaomi reveals key 12, 12 Pro specs while live photos leak",https://www.gsmarena.com/xiaomi_reveals_key_12_pro_specs_while_live_photos_leak-news-52439.php,2021-12-27T10:00:01Z
74,GSMArena.com,Peter,Winners and losers: Xiaomi,https://www.gsmarena.com/winners_and_losers_xiaomi-news-52076.php,2021-12-27T04:47:01Z
74,Bloomberg,Kristine Servando,Five Things You Need to Know to Start Your Day,https://www.bloomberg.com/news/newsletters/2021-12-29/five-things-you-need-to-know-to-start-your-day,2021-12-29T23:34:29Z
74,Forbes,"Russell Flannery, Forbes Staff, 
 Russell Flannery, Forbes Staff
 https://www.forbes.com/sites/russellflannery/",Anta Billionaire Clan Donates Nearly $1.2 Billion Of Shares Amid China “Common Prosperity” Push,https://www.forbes.com/sites/russellflannery/2021/12/20/anta-billionaire-clan-donates-nearly-12-billion-of-shares-amid-china-common-prosperity-push/,2021-12-21T00:23:32Z
74,Forbes,"Jemima McEvoy, Forbes Staff, 
 Jemima McEvoy, Forbes Staff
 https://www.forbes.com/sites/jemimamcevoy/",The Biggest Losers: These 10 Billionaires Each Lost At Least $10 Billion This Year,https://www.forbes.com/sites/jemimamcevoy/2021/12/21/the-biggest-losers-these-10-billionaires-each-lost-at-least-10-billion-this-year/,2021-12-21T11:30:00Z
74,The Sydney Morning Herald,Venus Feng,‘Best days are behind us’: China’s tech moguls see $110 billion of wealth evaporate in 2021 - Sydney Morning Herald,https://www.smh.com.au/business/markets/best-days-are-behind-us-china-s-tech-moguls-see-110-billion-of-wealth-evaporate-in-2021-20211230-p59ksq.html,2021-12-29T21:32:13Z
74,Yahoo Entertainment,Venus Feng,China’s Tech Moguls See $80 Billion of Wealth Evaporate in 2021 - Yahoo Finance,https://finance.yahoo.com/news/china-tech-moguls-see-80-170000471.html,2021-12-29T17:00:00Z
74,Yahoo Entertainment,Venus Feng,China’s Tech Moguls See $80 Billion of Wealth Evaporate in 2021 - Yahoo Finance,https://finance.yahoo.com/news/china-tech-moguls-see-80-170000902.html,2021-12-29T17:00:00Z
74,Techviral.net,Farhan Shaikh,Xiaomi Unveils MIUI 13: Here’s The List of Supported Devices,https://techviral.net/xiaomi-miui-13/,2021-12-30T08:39:45Z
74,Digitimes,Jessie Shen,Xiaomi sets up CNY1.5 billion subsidiary for ICs,https://www.digitimes.com/news/a20211217PD206.html,2021-12-20T01:18:40Z
